{
  "format": "nfai.exchange",
  "version": 1,
  "export": { "id": "export-p6a-01", "createdAt": "2026-08-13T00:00:00Z", "origin": { "platform": "ANDROID", "appVersion": "0.3.0-p5d" }, "semanticHash": "ad41c1ee6aa64b9e2f218034dbefccc333c43fb923b874b12ff51ce5972d4031", "sensitivity": "NORMAL" },
  "projects": [{ "id": "project-p6a-01", "title": "P6-A 交换夹具", "description": "非敏感协议验证项目", "pinned": true, "archived": false, "revision": 1, "createdAt": "2026-08-13T00:00:00Z", "updatedAt": "2026-08-13T00:00:00Z" }],
  "conversations": [{ "id": "conversation-p6a-01", "projectId": "project-p6a-01", "title": "非敏感会话", "currentLeafId": "message-p6a-02", "pinned": false, "archived": false, "revision": 1, "createdAt": "2026-08-13T00:00:00Z", "updatedAt": "2026-08-13T00:00:00Z", "messages": [{ "id": "message-p6a-01", "parentId": null, "ordinal": 0, "role": "user", "delivery": "COMPLETE", "revision": 1, "createdAt": "2026-08-13T00:00:00Z", "blocks": [{ "kind": "TEXT", "ordinal": 0, "text": "非敏感夹具文本。" }] }, { "id": "message-p6a-02", "parentId": "message-p6a-01", "ordinal": 0, "role": "assistant", "delivery": "COMPLETE", "revision": 1, "createdAt": "2026-08-13T00:00:01Z", "blocks": [{ "kind": "ASSET_REF", "ordinal": 0, "asset": { "id": "asset-p6a-01", "entry": "assets/3f3fa3e4842fd4d54be489e980058c1aaf1bd89951dd0dd521e29f0b81639969", "mimeType": "text/plain", "displayName": "golden-note.txt", "byteCount": 43, "sha256": "3f3fa3e4842fd4d54be489e980058c1aaf1bd89951dd0dd521e29f0b81639969", "classification": "NORMAL" } }] }] }],
  "knowledge": [{ "id": "knowledge-p6a-01", "title": "协议知识", "body": "夹具只用于本地语义交换验证。", "tags": ["protocol", "fixture"], "scope": "GLOBAL", "projectId": null, "status": "ACTIVE", "revision": 1, "contentHash": "d856efc99d693ccdd71a5ac11157307eaa99e7bc33ecd97ea889b9a9913977df", "createdAt": "2026-08-13T00:00:00Z", "updatedAt": "2026-08-13T00:00:00Z", "classification": "NORMAL" }],
  "memory": [{ "id": "memory-p6a-01", "body": "该数据仅允许本地预览。", "scope": "PROJECT", "scopeId": "project-p6a-01", "status": "ACTIVE", "revision": 1, "contentHash": "00da9715e59263b7577918986abdb0d45da73d8996efdbe510808058f0efff43", "createdAt": "2026-08-13T00:00:00Z", "updatedAt": "2026-08-13T00:00:00Z", "classification": "HIGH_SENSITIVE" }],
  "relations": [{ "id": "relation-p6a-01", "fromId": "knowledge-p6a-01", "toId": "project-p6a-01", "kind": "RELATED", "status": "ACTIVE", "revision": 1, "createdAt": "2026-08-13T00:00:00Z" }],
  "settings": { "uiLanguage": "zh-CN", "theme": "SYSTEM" }
}
